CO_PROVA;CO_POSICAO;enunciado;alternativa_A;alternativa_B;alternativa_C;alternativa_D;alternativa_E;gabarito;TP_LINGUA;NU_PARAM_B
1395;30;"TEXTO I A 13 de fevereiro de 1946, Graciliano Ramos escreve uma carta a Cândido Portinari relembrando uma visita que lhe fizera quando tivera a ocasião de apreciar algumas telas da série Retirantes. Diz o escritor alagoano: Caríssimo Portinari: A sua carta chegou muito atrasada, e receio que esta resposta já não o ache fixando na tela a nossa pobre gente da roça. Não há trabalho mais digno, penso eu. Dizem que somos pessimistas e exibimos deformações; contudo, as deformações e essa miséria existem fora da arte e são cultivadas pelos que nos censuram. [...] Dos quadros que você me mostrou quando almocei no Cosme Velho pela última vez, o que mais me comoveu foi aquela mãe com a criança morta. Saí de sua casa com um pensamento horrível: numa sociedade sem classes e sem miséria, seria possível fazer-se aquilo? Numa vida tranquila e feliz, que espécie de arte surgiria? Chego a pensar que teríamos cromos, anjinhos cor-de-rosa, e isto me horroriza. Graciliano Disponível em: https://graciliano.com.br . Acesso em: 6 fev. 2024 (adaptado). TEXTO II Histórias de ninar (adultos) Houve um tempo – tão perto, e, ó, tão longe, – em que a arte era um holofote na unha encravada, não um campeonato de melhores esmaltes. Raskolnikov marava velhinhas, a família de Gregor Samsa o assassinava a ""maçãzadas"", Memórias póstumas de Brás Cubas (Machado de Assis) é o retrato mais perfeito de tudo o que tem de pior na sociedade brasileira, uma sequência tristemente hilária de ações moralmente condenáveis, atitudes pusilânimes, cálculos mesquinhos e maus passos cretinos. A literatura, o cinema e o teatro vêm se transformando num exercício de lacração: o mal está sempre no outro, os protagonistas são ironmen/women da virtude. A pessoa sai da leitura ou da sessão não com a guarda abaixada, as certezas abaladas, mais próxima da verdade (ou, à falta de uma palavra melhor, da sinceridade): sai com suas certezas reforçadas. A realidade é confusa. Contraditória. Muitas vezes incompreensível. A arte é onde tentamos nos mostrar nus, com todos os nossos defeitos. PRATA, A. Disponível em: www1.folha.uol.com.br. Acesso em: 12 jan. 2024 (adaptado). No que diz respeito à arte, o posicionamento de Antônio Prata, no Texto II, aproxima-se da tese de Graciliano Ramos, no Texto I, uma vez que ambos";defendem a dignidade do ofício dos artistas.;concluem que a arte reforça crenças pessoais.;apresentam a pobreza como inspiração para a arte.;afirmam o necessário caráter desestabilizador da arte.;atestam que há mudanças significativas na produção artística.;D;;0.99473
1395;31;"Cap. XLVIII / Terpsícore Ao contrário do que ficou dito atrás, Flora não se aborreceu na ilha. Conjeturei mal, emendo-me a tempo. Podia aborrecer-se pelas razões que lá ficam, e ainda outras que poupei ao leitor apressado; mas, em verdade, passou bem a noite. A novidade da festa, a vizinhança do mar, os navios perdidos na sombra, a cidade defronte com os seus lampiões de gás, embaixo e em cima, na praia e nos outeiros, eis aí aspectos novos que a encantaram durante aquelas horas rápidas. Não lhe faltavam pares, nem conversação, nem alegria alheia e própria. Toda ela compartia da felicidade dos outros. Via, ouvia, sorria, esquecia-se do resto para se meter consigo. Também invejava a princesa imperial, que viria a ser imperatriz um dia, com o absoluto poder de despedir ministros e damas, visitas e requerentes, e ficar só, no mais recôndito do paço, fartando-se de contemplação ou de música. Era assim que Flora definia o ofício de governar. Tais ideias passavam e tornavam. De uma vez alguém lhe disse, como para lhe dar força: “Toda alma livre é imperatriz.” ASSIS, M. Esaú e Jacó. Rio de Janeiro: Nova Aguilar, 1974. Convidada para o último baile do Império, na Ilha Fiscal, localizada no Rio de Janeiro, Flora devaneia sobre aspectos daquele contexto, no qual o narrador ironiza a";promessa de esperança com o futuro regime.;alienação da elite em relação ao fim da monarquia.;perspectiva da contemplação distanciada da capital.;animosidade entre população e membros da nobreza.;fantasia de amor e de casamento da mulher burguesa.;B;;206747,00
1395;32;Marília acorda Tomo café em golinhos para não queimar meus lábios ressequidos. Como pão em pedacinhos para não engasgar com um farelo mais duro. Marília come também, mas olha o tempo todo para baixo. Parece que tem um acanhamento novo entre a gente. Termino. Olho mais uma vez pela janela. O dia está bom. Quero caminhar pelo pátio. Marília levanta, pega o andador e põe ao lado da cama. Ela sabe que eu quero levantar sozinha, e levanto. O lance de escadas, apesar de pequeno, ainda me causa problemas, mas não quero um elevador na casa e não vou tolerar descer uma rampa de cadeira de rodas. Marília abre a porta e saímos para a manhã. O dia está mais fresco do que eu imaginava. Ela pega uma manta de tricô que temos desde não sei quando e põe sobre as minhas costas. Ela aperta meus ombros com muita força, porque mesmo depois de todos esses anos, não descobriu a medida certa do carinho. Eu gosto. Porque entendo que naquele ato, naquela força está o nosso carinho. POLESSO, N. B. Amora . Porto Alegre: Não Editora, 2015. Nesse trecho, o drama do declínio físico da narradora transmite uma sensibilidade lírica centrada na;necessidade de fazer adaptações na casa.;atmosfera de afeto fortalecido pelo convívio.;condição de dependência de outras pessoas.;determinação de manter a regularidade da rotina.;aceitação das restrições de mobilidade da personagem.;B;;0.88701
1395;33;"Disponível em: https://defesacivil.rs.gov.br. Acesso em: 11 mar. 2024 (adaptado). Nesse cartaz, a expressão ""Vou deixar que você se vá"", em conjunto com os elementos não verbais utilizados, tem a finalidade de";incentivar o descarte de itens defeituosos.;promover a reciclagem de produtos usados.;garantir a conservação de roupas de inverno.;relacionar o gesto de doação à ideia de desapego.;comparar a peça de roupa ao sentimento de despedida.;D;;-0.78889
1395;34;"Teclado amazônico Em novembro de 2023, uma professora indígena recebeu uma missão: verter as regras de um jogo de tabuleiro infantil do português para o tukano, sua língua nativa. Com vinte anos de experiência como professora de línguas em Taracuá, no Amazonas, ela já se dedicava à tradução havia tempos. O trabalho ficou mais fácil graças a um aplicativo lançado no ano anterior: com o Linklado em seu computador, ela traduziu as sete páginas das instruções do jogo em dois dias. Sem esse recurso, a tarefa seria bem mais trabalhosa. Antes dele, diz a professora, as transcrições de línguas indígenas exigiam o esforço quase manual de produzir diacríticos (acentos gráficos) e letras que não constam no teclado de aplicativos de mensagens ou programas de texto. Para a pesquisadora do Instituto Nacional de Pesquisas da Amazônia (Inpa), idealizadora do aplicativo, o Linklado representa uma revolução. O programa não restringe combinações de acentos, e isso poderá facilitar a criação de representações gráficas para fonemas que ainda não têm forma escrita. ""Eu mirei em uma dor e atingimos várias outras"", diz. ""O Linklado possibilita que o Brasil reconheça a sua diversidade linguística"", afirma uma antropóloga que é colega da pesquisadora no Inpa e faz parte da equipe do aplicativo. Ela defende que escrever na língua materna é uma das principais formas de preservá-la. Disponível em: http://piaui.folha.uol.com.br. Acesso em: 3 fev. 2024 (adaptado). De acordo com esse texto, o aplicativo Linklado contribuiu para a";criação de fonemas representativos de línguas indígenas no meio digital.;democratização do registro escrito de línguas dos povos originários.;adaptação de regras de jogos de tabuleiro de origem indígena.;divulgação das técnicas de tradução de línguas indígenas.;aprendizagem da língua portuguesa pelos indígenas.;B;;123509,00
1395;35;"– Eu lhe juro, Aurélia. Estes lábios nunca tocaram a face de outra mulher, que não fosse minha mãe. Meu primeiro beijo de amor, guardei-o para minha esposa, para ti... [...] – Ou de outra mais rica! – disse ela, retraindo-se para fugir ao beijo do marido, e afastando-o com a ponta dos dedos. A voz da moça tomara o timbre cristalino, eco da rispidez e aspereza do sentimento que lhe sublevava o seio, e que parecia ringir-lhe nos lábios como aço. – Aurélia! Que significa isto? – Representamos uma comédia, na qual ambos desempenhamos o nosso papel com perícia consumada. Podemos ter este orgulho, que os melhores atores não nos excederiam. Mas é tempo de pôr termo a esta cruel mistificação, com que nos estamos escarnecendo mutuamente, senhor. Entremos na realidade por mais triste que ela seja; e resigne-se cada um ao que é, eu, uma mulher traída; o senhor, um homem vendido. – Vendido! – exclamou Seixas ferido dentro d'alma. – Vendido, sim: não tem outro nome. Sou rica, muito rica; sou milionária; precisava de um marido, traste indispensável às mulheres honestas. O senhor estava no mercado; comprei-o. Custou-me cem contos de réis, foi barato; não se fez valer. Eu daria o dobro, o triplo, toda a minha riqueza por este momento. ALENCAR, J. Senhora . Rio de Janeiro: Tecnoprint, 2003. Ao tematizar o casamento, esse fragmento reproduz uma concepção de literatura romântica evidenciada na";defesa da igualdade de gêneros.;importância atribuída à castidade.;indignação com as injustiças sociais.;interferência da riqueza sobre o amor.;valorização das relações interpessoais.;D;;-0.38987
1395;36;TEXTO I Anônimo. Cabeça de uma figura feminina. Circa 2700-2500 a.C. Escultura em mármore, 8 x 3,2 cm. Metropolitan Museum of Art, Nova Iorque. TEXTO II MODIGLIANI, A. Cabeça de mulher. Circa 1910-1911. Escultura em calcário, 68,3 x 15,9 x 24,1 cm. National Gallery of Art, Washington. WOLKOFF, J. These 5,000-Year-Old Sculptures Look Shockingly Similar to Modern Art. Disponível em: www.artsy.net. Acesso em: 19 jun. 2019. A leitura comparativa das duas esculturas, separadas por mais de 2500 anos, indica a;valorização da arte antiga por artistas contemporâneos.;resistência da arte escultórica aos avanços tecnológicos.;simplificação da forma em razão do tipo de material utilizado.;persistência de padrões estéticos em diferentes épocas e culturas.;ausência de detalhes como traço distintivo da arte tradicional popular.;D;;205523,00
1395;37;Se você é feito de música, este texto é pra você Às vezes, no silêncio da noite, eu fico imaginando: que graça teria a vida sem música? Sem ela não há paz, não há beleza. Nos dias de festa e nas madrugadas de pranto, nas trilhas dos filmes e nas corridas no parque, o que seria de nós sem as canções que enfeitam o cotidiano com ritmo e verso? Quem nunca curou uma dor de cotovelo dançando lambada ou terminou de se afundar ouvindo sertanejo sofrência? Quantos já criticaram funk e fecharam a noite descendo até o chão? Tudo bem... Raul nos ensinou que é preferível ser essa metamorfose ambulante do que ter aquela velha opinião formada sobre tudo. Já somos castigados com o peso das tragédias, o barulho das buzinas, os ruídos dos conflitos. É pau, é pedra, é o fim do caminho. Há uma nuvem de lágrimas sobre os olhos, você está na lanterna dos afogados, o coração despedaçado. Mas, como um sopro, da janela do vizinho, entra o samba que reanima a mente. Floresce do fundo do nosso quintal a batida que ressuscita o ânimo, sintoniza a alegria e equaliza o fôlego. Levanta, sacode a poeira, dá a volta por cima. BITTAR, L. Disponível em: www.revistabula.com. Acesso em: 21 nov. 2021 (adaptado). Defendendo a importância da música para o bem-estar e o equilíbrio emocional das pessoas, a autora usa, como recurso persuasivo, a;contradição, ao associar o coração despedaçado à alegria.;metáfora, ao citar a imagem da metamorfose ambulante.;intertextualidade, ao resgatar versos de letras de canções.;enumeração, ao mencionar diferentes ritmos musicais.;"hipérbole, ao falar em ""sofrência"", ""tragédias"" e ""afogados"".";C;;0.63797
1395;38;pessoas com suas malas mochilas e valises chegam e se vão se encontram se despedem e se despem de seus pertences como se pudessem chegar a algum lugar onde elas mesmas não estivessem RUIZ, A. In: SANT'ANNA, A. Rua Aribau: coletânea de poemas . Porto Alegre: TAG, 2018. Esse poema, por meio da ideia de deslocamento, metaforiza a tentativa de pessoas;buscarem novos encontros.;fugirem da própria identidade.;procurarem lugares inexplorados.;partirem em experiências inusitadas.;desaparecerem da vida em sociedade.;B;;0.39677
1395;39;Falar errado é uma arte, Arnesto! No dia 6 de agosto de 1910, Emma Riccini Rubinato pariu um garoto sapeca em Valinhos e deu a ele o nome de João Rubinato. Na escola, João não passou do terceiro ano. Não era a área dele, tinha de escolher outra. Fez o que apareceu. Foi ser garçom, metalúrgico, até virar radialista, comediante, ator de cinema e TV, cantor e compositor. De samba. Como tinha sobrenome italiano, João resolveu mudar para emplacar seu samba. E como ia mudar o sobrenome, mudou o nome. Virou Adoniran Barbosa. O cara falava errado, voz rouca, pinta de malandro da roça. Virou ícone da música brasileira, o mais paulista de todos, falando errado e irritando Vinicius de Moraes, que ficou de bico fechado depois de ouvir a música que Adoniran fez para a letra Bom dia, tristeza , de autoria do Poetinha. Coisa de arrepiar. Para toda essa gente que implicava, Adoniran tinha uma resposta neoerudita: “Gosto de samba e não é fácil, pra mim, ser aceito como compositor, porque ninguém queria nada com as minhas letras que falavam ‘nóis vai’, ‘nóis fumo’, ‘nóis fizemo’, ‘nóis peguemo’. Acontece que é preciso saber falar errado. Falar errado é uma arte, senão vira deboche.” Ele sabia o que fazia. Por isso dizia que falar errado era uma arte. A sua arte. Escolhida a dedo porque casava com seu tipo. O Samba do Arnesto é um monumento à fala errada, assim como Tiro ao Álvaro . O erudito podia resmungar, mas o povo se identificava. PEREIRA, E. Disponível em: www.tribunapr.com.br. Acesso em: 8 jul. 2024 (adaptado). O “falar errado” a que o texto se refere constitui um preconceito em relação ao uso que Adoniran Barbosa fazia da língua em suas composições, pois esse uso;marcava a linguagem dos comediantes no mesmo período.;prejudicava a compreensão das canções pelo público.;denunciava a ausência de estilo nas letras de canção.;restringia a criação poética nas letras do compositor.;transgredia a norma-padrão vigente à época.;E;;0.31786
1395;40;"O festival folclórico de Parintins, no Amazonas, anunciou que o Boi Caprichoso levou, em 2018, seu 23º título — contra 31 do adversário Boi Garantido. Desde o fim do evento que não paro de cantar duas músicas que aprendi no Bumbódromo (arena onde ocorre o espetáculo). Revezo entre “ meu amor, eu sou feliz, ééé azul o meu país ”, obviamente do boi azul, o Caprichoso; e “ vermelhou o curral, a ideologia avermelhou ”, do boi vermelho, o Garantido. Esse revezamento seria proibido em Parintins, cidade tão dividida entre as torcidas dos bois. Em Parintins, você tem de ter um lado. Há aqueles que tentam fugir e dizem que são “garanchoso”, com os quais me identifiquei, mas esses são vistos com certo desdém. DYNEWICZ, L. Disponível em: https://viagem.estadao.com.br . Acesso em: 22 nov. 2018 (adaptado). A apropriação de elementos como rivalidade, competitividade, torcida e gritos de guerra pelo festival de Parintins evidencia a";escolha de um local específico para a festa.;importância atribuída pelos turistas aos bois.;interação social estabelecida após o evento.;aproximação da manifestação folclórica com o esporte.;composição de enredos musicais pelos “garanchosos”.;D;;0.81709
1395;41;O Brasil somou cerca de 60 mil novos casos de câncer de mama até o final de 2019, número que corresponde a 25% de todos os diagnósticos da condição registrados no país, segundo dados do Instituto Nacional do Câncer (Inca). Apesar de o Outubro Rosa ser o mês de conscientização sobre a questão voltada para as mulheres, é muito importante lembrar que um dos grandes mitos da medicina é o de que o câncer de mama não afeta o sexo masculino. Fatores importantes para detectar o câncer de mama masculino: 1. Genética: se houver casos na família, as chances são um pouco mais elevadas. 2. Hormônios: homens podem desenvolver tecido real das glândulas mamárias por tomarem certos medicamentos ou apresentarem níveis hormonais anormais. 3. Caroços: é necessário que os médicos se atentem a alguns sintomas suspeitos, como um caroço na área do tórax. 4. Retração na pele: em situações mais graves do câncer de mama masculino, é possível também ocorrer uma retração do mamilo. Disponível em: https://pebmed.com.br. Acesso em: 24 nov. 2021 (adaptado). As informações dessa reportagem auxiliam no combate ao câncer de mama masculino por apresentarem um alerta sobre o(s);sinais indicadores da doença.;índice de crescimento de casos.;exames para diagnóstico do tumor.;mitos a respeito da herança genética.;período de campanhas de conscientização.;A;;0.03767
1395;42;Feijoada à minha moda Amiga Helena Sangirardi Conforme um dia prometi Onde, confesso que esqueci E embora — perdoe — tão tarde (Melhor do que nunca!) este poeta Segundo manda a boa ética Envia-lhe a receita (poética) De sua feijoada completa. Em atenção ao adiantado Da hora em que abrimos o olho O feijão deve, já catado Nos esperar, feliz, de molho. Uma vez cozido o feijão (Umas quatro horas, fogo médio) Nós bocejando o nosso tédio Nos chegaremos ao fogão [...] De carne-seca suculenta Gordos paios, nédio toucinho (Nunca orelhas de bacorinho Que a tornam em excesso opulenta!) Enquanto ao lado, em fogo brando Dismilinguindo-se de gozo Deve também se estar fritando O torresminho delicioso Em cuja gordura, de resto (Melhor gordura nunca houve!) Deve depois frigir a couve Picada, em fogo alegre e presto. Dever cumprido. Nunca é vã A palavra de um poeta... — jamais! Abraça-a, em Brillat-Savarin, O seu Vinicius de Moraes. MORAES. V. In Cícero. A: QUEIROZ. E. (Org). Vinicius de Moraes nova antologia poética. São Paulo: Cia das Letras, 2005 (fragmento). Apesar de haver marcas formais de carta e receita, a característica que define esse texto como poema é o(a);nomeação de um interlocutor.;manifestação de intimidade.;descrição de procedimentos.;utilização de uma linguagem expressiva.;apresentação de ingredientes culinários.;D;;-0.12011
1395;43;TEXTO I A fotografia de Regina Valkenborgh apresenta 2953 arcos de luz cruzando o céu e registra o nascer e o pôr do sol ao longo de oito anos. Em 2012, essa estudante da Universidade de Hertfordshire colocou uma folha de papel fotográfico em uma lata com um pequeno orifício, criando assim uma câmera pinhole de baixa tecnologia. Porém, a lata foi esquecida em um telescópio no observatório da universidade. Esse projeto esquecido acabou revelando a foto do pôr do sol de maior exposição já tirada. SANTOS, A. Disponível em: https//socientifica.com.br. Acesso em: 13 nov. 2021 (adaptado). TEXTO II Representação de 2953 arcos de luz cruzando o céu, registrando o nascer e o pôr do sol ao longo de oito anos Disponível em: www.thisiscolossal.com. Acesso em: 1 nov. 2022. O experimento realizado por Regina Valkenborgh resultou no entendimento de que a;técnica fotográfica alternativa limita o registro de imagens.;apreciação da natureza depende de registro fotográfico.;criatividade artística decorre do conhecimento científico.;câmera de criação caseira tem valor tecnológico.;produção artística pode ser resultado do acaso.;E;;0.5031
1395;44;"Os Jogos Olímpicos já não são mais os mesmos. E isso não é nem uma crítica, nem um elogio. É uma constatação. Esse movimento começou com o vôlei de praia tornando-se esporte olímpico em 1996, passou pela chegada do BMX Racing como primeiro ""radical"" a entrar no programa em 2008, e agora atinge seu momento mais insólito com a inclusão do break dance como modalidade dos Jogos de Paris, em 2024. Para os mais tradicionalistas, o cruzamento da linha que delimitava o que é esporte e o que é cultura e arte é uma afronta ao espírito dos Jogos Olímpicos. Skate e surfe, que há anos têm competições na televisão, pareciam estar na divisa entre esses dois mundos, o limite do aceitável pelos puristas. O break dance estaria do lado de ""lá"" dessa fronteira. Para o Comitê Olímpico Internacional, a decisão faz parte de uma estratégia de se comunicar com jovens urbanos que se exercitam e se entretêm de uma maneira muito diferente da dos seus avós. Disponível em: www.uol.com.br. Acesso em: 19 nov. 2021 (adaptado). A mudança no programa olímpico mencionada no texto mostra que o esporte está se";aproximando da aventura.;mantendo em sua forma padrão.;tornando uma forma de dança.;afastando de elementos culturais.;adaptando às demandas do seu tempo.;E;;0.04613
1395;45;Memes e fake news: o impacto na educação das crianças Há quem diga que o Brasil nunca mais foi o mesmo depois dos memes. Na economia da velocidade, alguns apostam no humor, outros no engajamento político, e tem gente investindo alto na mentira também. Diante desse cenário, uma pergunta se torna essencial: será que todo mundo está conseguindo traduzir as mensagens postadas, curtidas e compartilhadas? Essa dúvida incentivou uma professora de língua portuguesa a desenvolver uma proposta de leitura e análise crítica de memes com estudantes do ensino fundamental, na rede pública do Distrito Federal, na cidade de Samambaia. “Percebi que muitos alunos e pais estavam divulgando conteúdos sem saber o que havia por trás das palavras”, relata a professora. “O que antes era engraçado para os alunos passou a ser visto com outros olhos”, afirma a professora. Para ela, que utilizou a representação da criança em memes de WhatsApp como material gerador das discussões em sala de aula, aguçar o olhar sobre essas mensagens impacta diretamente a atitude de postar, curtir e compartilhar conteúdos ao estimular o uso consciente da informação que circula nas plataformas de mídia social. Letramento político e midiático é um desafio intergeracional. Em tempos de notícias falsas, de imagens manipuladas e de memes sendo usados como triunfo da verdade de cada um, checagem de informação e interpretação de texto acabam se tornando moedas valiosas. Disponível em: http://funetas.com.br. Acesso em: 15 jan. 2024 (adaptação). Ao abordar a relação dos memes com a educação, a reportagem sustenta uma crítica à;falta de fiscalização no uso de aplicativos de mensagens por crianças.;divulgação de informação manipulada em postagens virtuais.;utilização de ferramentas digitais no trabalho educacional.;exploração de conteúdos humorísticos nas mídias sociais.;propagação de mensagens com objetivos políticos.;B;;-0.00945
1383;46;TEXTO I Um terremoto de magnitude 5,9 atingiu a cidade de Valparaíso, na costa chilena. O terremoto ocorreu a uma profundidade de 112 quilômetros. Terremoto de magnitude 5,9 atinge Valparaíso, no Chile. Disponível em: www.cnnbrasil.com.br . Acesso em: 6 nov. 2021 (adaptado). TEXTO II Um tremor de terra de magnitude 4,8 foi registrado no município de Atalaia do Norte, no interior do estado do Amazonas. O abalo é de magnitude considerada mediana para os níveis do Brasil. Os eventos dessa região costumam ser resultado das atividades da placa de Nazca. Tremor de terra de magnitude 4,8 é registrado no interior do Amazonas . Disponível em: https://g1.globo.com . Acesso em: 6 nov. 2021 (adaptado). TEXTO III Moradores usaram as redes sociais para relatar tremores de terra no interior de São Paulo. As atividades foram registradas nas cidades de Júlio Mesquita e Guaimbê e tiveram magnitude 3,0 na escala Richter, o que é considerado pequeno e sem previsão de danos. Moradores do interior de SP relatam tremores de terra. Disponível em: https://noticias.r7.com . Acesso em: 6 nov. 2021 (adaptado). As diferenças entre os eventos geológicos relatados decorrem de distintas posições geográficas das cidades em relação a:;Planícies costeiras.;Bacias continentais.;Zonas de subducção.;Áreas de denudação.;Vertentes escarpadas.;C;;124642,00
1383;47;"Tal qual num exército, não se compreende um efetivo composto apenas de oficiais. Também na saúde pública, os funcionários técnicos graduados necessitam ser assistidos por auxiliares em número suficiente e com preparo adequado, constituído pelas enfermeiras de saúde pública, educadoras ou visitadoras sanitárias, técnicos de laboratório, inspetores ou guardas etc., para não falarmos no pessoal burocrático, não especializado. PAULA SOUZA, G. H.; VIEIRA, F. B. Centro de saúde ""eixo"" de organização sanitária. Boletim do Instituto de Higiene de São Paulo , n. 59 (adaptado). O texto dos sanitaristas atuantes nas décadas de 1920 e 1930 veicula uma mensagem caracterizada pela";higienização moral.;imposição eugênica.;assimilação cultural.;hegemonização identitária.;hierarquização profissional.;E;;0.27283
